 CREATE DATABASE shirts_db;
Query OK, 1 row affected (0.00 sec)

mysql> USE shirts_db;
Database changed
mysql> CREATE TABLE shirts(
    -> shirt_id INT NOT NULL, article VARCHAR(100), color VARCHAR(100), shirt_size VARCHAR(4), last_worn INT), PRIMARY KEY(shirt_id);
ERROR 1064 (42000): You have an error in your SQL syntax; check the manual that corresponds to your MySQL server version for the right syntax to use near ' PRIMARY KEY(shirt_id)' at line 2
mysql> CREATE TABLE shirts( shirt_id INT NOT NULL PRIMARY KEY, article VARCHAR(100), color VARCHAR(100), shirt_size VARCHAR(4), last_worn INT);
Query OK, 0 rows affected (0.09 sec)
mysql> DESC shirts;
+------------+--------------+------+-----+---------+-------+
| Field      | Type         | Null | Key | Default | Extra |
+------------+--------------+------+-----+---------+-------+
| shirt_id   | int(11)      | NO   | PRI | NULL    |       |
| article    | varchar(100) | YES  |     | NULL    |       |
| color      | varchar(100) | YES  |     | NULL    |       |
| shirt_size | varchar(4)   | YES  |     | NULL    |       |
| last_worn  | int(11)      | YES  |     | NULL    |       |
+------------+--------------+------+-----+---------+-------+
5 rows in set (0.00 sec)

 mysql> INSERT INTO shirts(shirt_id, article, color, shirt_size, last_worn) VALUE ('t-shirt', 'white', 'S', 10),
    ->
    -> ('t-shirt', 'green', 'S', 200),
    ->
    -> ('polo shirt', 'black', 'M', 10),
    ->
    -> ('tank top', 'blue', 'S', 50),
    ->
    -> ('t-shirt', 'pink', 'S', 0),
    ->
    -> ('polo shirt', 'red', 'M', 5),
    ->
    -> ('tank top', 'white', 'S', 200),
    ->
    -> ('tank top', 'blue', 'M', 15);
ERROR 1136 (21S01): Column count doesn't match value count at row 1
mysql> SELECT * FROM shirts;
Empty set (0.00 sec)

mysql> ALTER TABLE shirts CHANGE shirt_id shirt_id INT NOT NULL AUTO_INCREMENT;
Query OK, 0 rows affected (0.23 sec)
Records: 0  Duplicates: 0  Warnings: 0

mysql> desc shirts;
+------------+--------------+------+-----+---------+----------------+
| Field      | Type         | Null | Key | Default | Extra          |
+------------+--------------+------+-----+---------+----------------+
| shirt_id   | int(11)      | NO   | PRI | NULL    | auto_increment |
| article    | varchar(100) | YES  |     | NULL    |                |
| color      | varchar(100) | YES  |     | NULL    |                |
| shirt_size | varchar(4)   | YES  |     | NULL    |                |
| last_worn  | int(11)      | YES  |     | NULL    |                |
+------------+--------------+------+-----+---------+----------------+
5 rows in set (0.00 sec)

mysql> INSERT INTO shirts(article, color, shirt_size, last_worn) VALUES ('t-shirt', 'white', 'S', 10),
    ->
    -> ('t-shirt', 'green', 'S', 200),
    ->
    -> ('polo shirt', 'black', 'M', 10),
    ->
    -> ('tank top', 'blue', 'S', 50),
    ->
    -> ('t-shirt', 'pink', 'S', 0),
    ->
    -> ('polo shirt', 'red', 'M', 5),
    ->
    -> ('tank top', 'white', 'S', 200),
    ->
    -> ('tank top', 'blue', 'M', 15);
Query OK, 8 rows affected (0.05 sec)
Records: 8  Duplicates: 0  Warnings: 0

mysql> SELECT * FROM shirts;
+----------+------------+-------+------------+-----------+
| shirt_id | article    | color | shirt_size | last_worn |
+----------+------------+-------+------------+-----------+
|        1 | t-shirt    | white | S          |        10 |
|        2 | t-shirt    | green | S          |       200 |
|        3 | polo shirt | black | M          |        10 |
|        4 | tank top   | blue  | S          |        50 |
|        5 | t-shirt    | pink  | S          |         0 |
|        6 | polo shirt | red   | M          |         5 |
|        7 | tank top   | white | S          |       200 |
|        8 | tank top   | blue  | M          |        15 |
+----------+------------+-------+------------+-----------+
8 rows in set (0.00 sec)

mysql> SELECT * FROM shirts;
+----------+------------+-------+------------+-----------+
| shirt_id | article    | color | shirt_size | last_worn |
+----------+------------+-------+------------+-----------+
|        1 | t-shirt    | white | S          |        10 |
|        2 | t-shirt    | green | S          |       200 |
|        3 | polo shirt | black | M          |        10 |
|        4 | tank top   | blue  | S          |        50 |
|        5 | t-shirt    | pink  | S          |         0 |
|        6 | polo shirt | red   | M          |         5 |
|        7 | tank top   | white | S          |       200 |
|        8 | tank top   | blue  | M          |        15 |
+----------+------------+-------+------------+-----------+
8 rows in set (0.00 sec)

mysql> INSERT INTO shirts(article, color, shirt_size, last_worn) VALUES (polo shirt, purple, M, 50);
ERROR 1064 (42000): You have an error in your SQL syntax; check the manual that corresponds to your MySQL server version for the right syntax to use near 'shirt, purple, M, 50)' at line 1
mysql> INSERT INTO shirts(article, color, shirt_size, last_worn) VALUES ('polo shirt', 'purple', 'M', '50');
Query OK, 1 row affected (0.01 sec)

mysql> SELECT article, color FROM shirts;
+------------+--------+
| article    | color  |
+------------+--------+
| t-shirt    | white  |
| t-shirt    | green  |
| polo shirt | black  |
| tank top   | blue   |
| t-shirt    | pink   |
| polo shirt | red    |
| tank top   | white  |
| tank top   | blue   |
| polo shirt | purple |
+------------+--------+
9 rows in set (0.00 sec)

mysql> SELECT article, color, shirt_size, last_worn FROM shirts WHERE shirt_size='M';
+------------+--------+------------+-----------+
| article    | color  | shirt_size | last_worn |
+------------+--------+------------+-----------+
| polo shirt | black  | M          |        10 |
| polo shirt | red    | M          |         5 |
| tank top   | blue   | M          |        15 |
| polo shirt | purple | M          |        50 |
+------------+--------+------------+-----------+
4 rows in set (0.00 sec)

mysql> SELECT * FROM shirts WHERE shirt_size='L';
Empty set (0.00 sec)

mysql> SELECT * FROM shirts WHERE article='polo shirt';
+----------+------------+--------+------------+-----------+
| shirt_id | article    | color  | shirt_size | last_worn |
+----------+------------+--------+------------+-----------+
|        3 | polo shirt | black  | M          |        10 |
|        6 | polo shirt | red    | M          |         5 |
|        9 | polo shirt | purple | M          |        50 |
+----------+------------+--------+------------+-----------+
3 rows in set (0.00 sec)

mysql> UPDATE * SET shirt_size='L' WHERE article='polo shirt';
ERROR 1064 (42000): You have an error in your SQL syntax; check the manual that corresponds to your MySQL server version for the right syntax to use near '* SET shirt_size='L' WHERE article='polo shirt'' at line 1
mysql> UPDATE shirts  SET shirt_size='L' WHERE article='polo shirt';
Query OK, 3 rows affected (0.01 sec)
Rows matched: 3  Changed: 3  Warnings: 0

mysql> UPDATE * SET shirt_size='L' WHERE article='polo shirt';
ERROR 1064 (42000): You have an error in your SQL syntax; check the manual that corresponds to your MySQL server version for the right syntax to use near '* SET shirt_size='L' WHERE article='polo shirt'' at line 1
mysql> SELECT * FROM shirts WHERE article='polo shirt';
+----------+------------+--------+------------+-----------+
| shirt_id | article    | color  | shirt_size | last_worn |
+----------+------------+--------+------------+-----------+
|        3 | polo shirt | black  | L          |        10 |
|        6 | polo shirt | red    | L          |         5 |
|        9 | polo shirt | purple | L          |        50 |
+----------+------------+--------+------------+-----------+
3 rows in set (0.00 sec)

mysql> SELECT * FROM shirts WHERE last_worn=15;
+----------+----------+-------+------------+-----------+
| shirt_id | article  | color | shirt_size | last_worn |
+----------+----------+-------+------------+-----------+
|        8 | tank top | blue  | M          |        15 |
+----------+----------+-------+------------+-----------+
1 row in set (0.00 sec)

mysql> UPDATE shirts SET last_worn=0 WHERE last_worn=15;
Query OK, 1 row affected (0.01 sec)
Rows matched: 1  Changed: 1  Warnings: 0

mysql> SELECT * FROM shirts WHERE last_worn=15;
Empty set (0.00 sec)

mysql> UPDATE shirts SET last_worn=0 WHERE last_worn=15;
Query OK, 1 row affected (0.01 sec)
Rows matched: 1  Changed: 1  Warnings: 0

mysql> SELECT * FROM shirts WHERE last_worn=15;
Empty set (0.00 sec)

mysql> SELECT * FROM shirts WHERE color='white';
+----------+----------+-------+------------+-----------+
| shirt_id | article  | color | shirt_size | last_worn |
+----------+----------+-------+------------+-----------+
|        1 | t-shirt  | white | S          |        10 |
|        7 | tank top | white | S          |       200 |
+----------+----------+-------+------------+-----------+
2 rows in set (0.00 sec)

mysql> UPDATE shirts SET shirt_size='XS', color='off white' WHERE color='white';
Query OK, 2 rows affected (0.01 sec)
Rows matched: 2  Changed: 2  Warnings: 0

mysql> SELECT * FROM shirts WHERE color='white';
Empty set (0.00 sec)

mysql> DELETE FROM shirts WHERE last worn=200;
ERROR 1064 (42000): You have an error in your SQL syntax; check the manual that corresponds to your MySQL server version for the right syntax to use near 'worn=200' at line 1
mysql> DELETE FROM shirts WHERE last_worn=200;
Query OK, 2 rows affected (0.02 sec)

mysql> DELETE FROM shirts WHERE article='tank top';
Query OK, 2 rows affected (0.02 sec)

mysql> SELECT * FROM shirts;
+----------+------------+-----------+------------+-----------+
| shirt_id | article    | color     | shirt_size | last_worn |
+----------+------------+-----------+------------+-----------+
|        1 | t-shirt    | off white | XS         |        10 |
|        3 | polo shirt | black     | L          |        10 |
|        5 | t-shirt    | pink      | S          |         0 |
|        6 | polo shirt | red       | L          |         5 |
|        9 | polo shirt | purple    | L          |        50 |
+----------+------------+-----------+------------+-----------+
5 rows in set (0.00 sec)

mysql> DELETE FROM shirts;
